{
  "description": "PodSecurityPolicySpec defines the policy enforced.",
  "properties": {
    "allowPrivilegeEscalation": {
      "description": "allowPrivilegeEscalation determines if a pod can request to allow privilege escalation. If unspecified, defaults to true.",
      "type": [
        "boolean",
        "null"
      ]
    },
    "allowedCSIDrivers": {
      "description": "AllowedCSIDrivers is an allowlist of inline CSI drivers that must be explicitly set to be embedded within a pod spec. An empty value indicates that any CSI driver can be used for inline ephemeral volumes. This is a beta field, and is only honored if the API server enables the CSIInlineVolume feature gate.",
      "items": {
        "$ref": "_definitions.json#/definitions/io.k8s.api.policy.v1beta1.AllowedCSIDriver"
      },
      "type": [
        "array",
        "null"
      ]
    },
    "allowedCapabilities": {
      "description": "allowedCapabilities is a list of capabilities that can be requested to add to the container. Capabilities in this field may be added at the pod author's discretion. You must not list a capability in both allowedCapabilities and requiredDropCapabilities.",
      "items": {
        "type": [
          "string",
          "null"
        ]
      },
      "type": [
        "array",
        "null"
      ]
    },
    "allowedFlexVolumes": {
      "description": "allowedFlexVolumes is an allowlist of Flexvolumes.  Empty or nil indicates that all Flexvolumes may be used.  This parameter is effective only when the usage of the Flexvolumes is allowed in the \"volumes\" field.",
      "items": {
        "$ref": "_definitions.json#/definitions/io.k8s.api.policy.v1beta1.AllowedFlexVolume"
      },
      "type": [
        "array",
        "null"
      ]
    },
    "allowedHostPaths": {
      "description": "allowedHostPaths is an allowlist of host paths. Empty indicates that all host paths may be used.",
      "items": {
        "$ref": "_definitions.json#/definitions/io.k8s.api.policy.v1beta1.AllowedHostPath"
      },
      "type": [
        "array",
        "null"
      ]
    },
    "allowedProcMountTypes": {
      "description": "AllowedProcMountTypes is an allowlist of allowed ProcMountTypes. Empty or nil indicates that only the DefaultProcMountType may be used. This requires the ProcMountType feature flag to be enabled.",
      "items": {
        "type": [
          "string",
          "null"
        ]
      },
      "type": [
        "array",
        "null"
      ]
    },
    "allowedUnsafeSysctls": {
      "description": "allowedUnsafeSysctls is a list of explicitly allowed unsafe sysctls, defaults to none. Each entry is either a plain sysctl name or ends in \"*\" in which case it is considered as a prefix of allowed sysctls. Single * means all unsafe sysctls are allowed. Kubelet has to allowlist all allowed unsafe sysctls explicitly to avoid rejection.\n\nExamples: e.g. \"foo/*\" allows \"foo/bar\", \"foo/baz\", etc. e.g. \"foo.*\" allows \"foo.bar\", \"foo.baz\", etc.",
      "items": {
        "type": [
          "string",
          "null"
        ]
      },
      "type": [
        "array",
        "null"
      ]
    },
    "defaultAddCapabilities": {
      "description": "defaultAddCapabilities is the default set of capabilities that will be added to the container unless the pod spec specifically drops the capability.  You may not list a capability in both defaultAddCapabilities and requiredDropCapabilities. Capabilities added here are implicitly allowed, and need not be included in the allowedCapabilities list.",
      "items": {
        "type": [
          "string",
          "null"
        ]
      },
      "type": [
        "array",
        "null"
      ]
    },
    "defaultAllowPrivilegeEscalation": {
      "description": "defaultAllowPrivilegeEscalation controls the default setting for whether a process can gain more privileges than its parent process.",
      "type": [
        "boolean",
        "null"
      ]
    },
    "forbiddenSysctls": {
      "description": "forbiddenSysctls is a list of explicitly forbidden sysctls, defaults to none. Each entry is either a plain sysctl name or ends in \"*\" in which case it is considered as a prefix of forbidden sysctls. Single * means all sysctls are forbidden.\n\nExamples: e.g. \"foo/*\" forbids \"foo/bar\", \"foo/baz\", etc. e.g. \"foo.*\" forbids \"foo.bar\", \"foo.baz\", etc.",
      "items": {
        "type": [
          "string",
          "null"
        ]
      },
      "type": [
        "array",
        "null"
      ]
    },
    "fsGroup": {
      "$ref": "_definitions.json#/definitions/io.k8s.api.policy.v1beta1.FSGroupStrategyOptions",
      "description": "fsGroup is the strategy that will dictate what fs group is used by the SecurityContext."
    },
    "hostIPC": {
      "description": "hostIPC determines if the policy allows the use of HostIPC in the pod spec.",
      "type": [
        "boolean",
        "null"
      ]
    },
    "hostNetwork": {
      "description": "hostNetwork determines if the policy allows the use of HostNetwork in the pod spec.",
      "type": [
        "boolean",
        "null"
      ]
    },
    "hostPID": {
      "description": "hostPID determines if the policy allows the use of HostPID in the pod spec.",
      "type": [
        "boolean",
        "null"
      ]
    },
    "hostPorts": {
      "description": "hostPorts determines which host port ranges are allowed to be exposed.",
      "items": {
        "$ref": "_definitions.json#/definitions/io.k8s.api.policy.v1beta1.HostPortRange"
      },
      "type": [
        "array",
        "null"
      ]
    },
    "privileged": {
      "description": "privileged determines if a pod can request to be run as privileged.",
      "type": [
        "boolean",
        "null"
      ]
    },
    "readOnlyRootFilesystem": {
      "description": "readOnlyRootFilesystem when set to true will force containers to run with a read only root file system.  If the container specifically requests to run with a non-read only root file system the PSP should deny the pod. If set to false the container may run with a read only root file system if it wishes but it will not be forced to.",
      "type": [
        "boolean",
        "null"
      ]
    },
    "requiredDropCapabilities": {
      "description": "requiredDropCapabilities are the capabilities that will be dropped from the container.  These are required to be dropped and cannot be added.",
      "items": {
        "type": [
          "string",
          "null"
        ]
      },
      "type": [
        "array",
        "null"
      ]
    },
    "runAsGroup": {
      "$ref": "_definitions.json#/definitions/io.k8s.api.policy.v1beta1.RunAsGroupStrategyOptions",
      "description": "RunAsGroup is the strategy that will dictate the allowable RunAsGroup values that may be set. If this field is omitted, the pod's RunAsGroup can take any value. This field requires the RunAsGroup feature gate to be enabled."
    },
    "runAsUser": {
      "$ref": "_definitions.json#/definitions/io.k8s.api.policy.v1beta1.RunAsUserStrategyOptions",
      "description": "runAsUser is the strategy that will dictate the allowable RunAsUser values that may be set."
    },
    "runtimeClass": {
      "$ref": "_definitions.json#/definitions/io.k8s.api.policy.v1beta1.RuntimeClassStrategyOptions",
      "description": "runtimeClass is the strategy that will dictate the allowable RuntimeClasses for a pod. If this field is omitted, the pod's runtimeClassName field is unrestricted. Enforcement of this field depends on the RuntimeClass feature gate being enabled."
    },
    "seLinux": {
      "$ref": "_definitions.json#/definitions/io.k8s.api.policy.v1beta1.SELinuxStrategyOptions",
      "description": "seLinux is the strategy that will dictate the allowable labels that may be set."
    },
    "supplementalGroups": {
      "$ref": "_definitions.json#/definitions/io.k8s.api.policy.v1beta1.SupplementalGroupsStrategyOptions",
      "description": "supplementalGroups is the strategy that will dictate what supplemental groups are used by the SecurityContext."
    },
    "volumes": {
      "description": "volumes is an allowlist of volume plugins. Empty indicates that no volumes may be used. To allow all volumes you may use '*'.",
      "items": {
        "type": [
          "string",
          "null"
        ]
      },
      "type": [
        "array",
        "null"
      ]
    }
  },
  "required": [
    "seLinux",
    "runAsUser",
    "supplementalGroups",
    "fsGroup"
  ],
  "type": "object",
  "$schema": "http://json-schema.org/schema#"
}