{
  "additionalProperties": false, 
  "required": [
    "type", 
    "status"
  ], 
  "description": "DeploymentCondition describes the state of a deployment at a certain point.", 
  "properties": {
    "status": {
      "type": "string", 
      "description": "Status of the condition, one of True, False, Unknown."
    }, 
    "lastUpdateTime": {
      "type": "string", 
      "format": "date-time"
    }, 
    "lastTransitionTime": {
      "type": "string", 
      "format": "date-time"
    }, 
    "reason": {
      "type": "string", 
      "description": "The reason for the condition's last transition."
    }, 
    "message": {
      "type": "string", 
      "description": "A human readable message indicating details about the transition."
    }, 
    "type": {
      "type": "string", 
      "description": "Type of deployment condition."
    }
  }
}